{
 "$schema":"https://json-schema.org/draft/2020-12/schema","$id":"https://adp.dev/schema/delegation-result.schema.json","title":"DelegationResult","type":"object","additionalProperties":false,"required":["specVersion","delegationId","status"],
 "properties":{"specVersion":{"const":"0.1"},"delegationId":{"type":"string","minLength":1},"status":{"enum":["completed","partial","failed","cancelled","budget_exhausted","rejected"]},"summary":{"type":"string"},"output":{},"artifacts":{"type":"array","items":{"$ref":"artifact.schema.json"}},"acceptance":{"type":"array","items":{"type":"object","additionalProperties":false,"required":["criterionId","status"],"properties":{"criterionId":{"type":"string"},"status":{"enum":["passed","failed","not_run","needs_review"]},"evidenceArtifactIds":{"type":"array","items":{"type":"string"}},"message":{"type":"string"},"evaluator":{"enum":["worker","caller","external","human"]}}}},"usage":{"type":"object","additionalProperties":false,"properties":{"inputTokens":{"type":"integer","minimum":0},"outputTokens":{"type":"integer","minimum":0},"totalTokens":{"type":"integer","minimum":0},"cost":{"type":"number","minimum":0},"currency":{"type":"string"},"wallClockMs":{"type":"integer","minimum":0},"childDelegations":{"type":"integer","minimum":0}}},"diagnostics":{"type":"array","items":{"type":"object","additionalProperties":false,"required":["level","message"],"properties":{"level":{"enum":["info","warning","error"]},"code":{"type":"string"},"message":{"type":"string"}}}},"metadata":{"type":"object","additionalProperties":{"type":"string"}}}
}
