{"specVersion":"0.1","delegationId":"rate-limit-42","status":"completed","summary":"Implemented token bucket with deterministic clock injection.","output":{"changedFiles":["src/rate-limit.ts","test/rate-limit.test.ts"]},"artifacts":[{"id":"changes-1","kind":"patch","mediaType":"text/x-diff","uri":"workspace:artifacts/rate-limit.patch","digest":"sha256:aaaaaaaaaaaaaaaaaaaaaaaaaaaaaaaaaaaaaaaaaaaaaaaaaaaaaaaaaaaaaaaa","size":2841,"producerDelegationId":"rate-limit-42","path":"artifacts/rate-limit.patch"},{"id":"tests-1","kind":"test_report","mediaType":"application/json","uri":"workspace:artifacts/test-report.json","digest":"sha256:bbbbbbbbbbbbbbbbbbbbbbbbbbbbbbbbbbbbbbbbbbbbbbbbbbbbbbbbbbbbbbbb","size":412,"producerDelegationId":"rate-limit-42"}],"acceptance":[{"criterionId":"tests","status":"passed","evidenceArtifactIds":["tests-1"],"evaluator":"worker"},{"criterionId":"burst","status":"needs_review","evidenceArtifactIds":["changes-1"],"evaluator":"caller"}],"usage":{"inputTokens":4100,"outputTokens":2900,"wallClockMs":83000,"childDelegations":0}}
